{
  "$schema": "https://pliegors.dev/schemas/pliego.asset-manifest.schema.json",
  "manifestVersion": "1.0.0",
  "work": {
    "kind": "house",
    "id": "pliegors-site",
    "slug": "pliegors-site",
    "title": "PliegoRS Site",
    "owner": "Celiums Solutions LLC / PliegoRS"
  },
  "coverage": {
    "assetRoot": "public",
    "trackedExtensions": [
      ".avif",
      ".ico",
      ".jpg",
      ".mp4",
      ".pdf",
      ".png",
      ".svg",
      ".webp",
      ".woff2",
      ".zip"
    ],
    "excluded": []
  },
  "assets": [
    {
      "id": "asset-apple-touch-icon-png",
      "label": "Apple Touch Icon",
      "owner": {
        "entity": "Celiums Solutions LLC / PliegoRS",
        "role": "house"
      },
      "source": {
        "kind": "generated",
        "locator": "public/apple-touch-icon.png",
        "generator": "PliegoRS asset pipeline",
        "createdFor": "pliegors-site"
      },
      "rights": {
        "status": "owned",
        "holder": "Celiums Solutions LLC",
        "transfer": "excluded"
      },
      "visualImportance": "utility",
      "tags": [
        "visual",
        "framework-surface"
      ],
      "variants": [
        {
          "id": "v-apple-touch-icon-png",
          "path": "apple-touch-icon.png",
          "mediaType": "image/png",
          "format": "png",
          "sha256": "0fd6bef4997722c3a04f148de246f8b2d183ae3a5954d33d83aa28276cd2c4fd",
          "bytes": 3039,
          "tiers": [
            "universal",
            "lite",
            "balanced",
            "signature"
          ],
          "delivery": "on-demand",
          "preload": false,
          "dimensions": {
            "width": 180,
            "height": 180
          },
          "estimatedVramBytes": 129600
        }
      ]
    },
    {
      "id": "asset-favicon-ico",
      "label": "Favicon",
      "owner": {
        "entity": "Celiums Solutions LLC / PliegoRS",
        "role": "house"
      },
      "source": {
        "kind": "owned",
        "locator": "public/favicon.ico",
        "createdFor": "pliegors-site"
      },
      "rights": {
        "status": "owned",
        "holder": "Celiums Solutions LLC",
        "transfer": "excluded"
      },
      "visualImportance": "critical",
      "tags": [
        "visual",
        "framework-surface"
      ],
      "variants": [
        {
          "id": "v-favicon-ico",
          "path": "favicon.ico",
          "mediaType": "image/x-icon",
          "format": "ico",
          "sha256": "2ac9ce61ea604f2054687c758c44239105ebae874183ae99458bec0f7fea1eb3",
          "bytes": 12918,
          "tiers": [
            "universal",
            "lite",
            "balanced",
            "signature"
          ],
          "delivery": "initial",
          "preload": false
        }
      ]
    },
    {
      "id": "asset-favicon-svg",
      "label": "Favicon",
      "owner": {
        "entity": "Celiums Solutions LLC / PliegoRS",
        "role": "house"
      },
      "source": {
        "kind": "owned",
        "locator": "public/favicon.svg",
        "createdFor": "pliegors-site"
      },
      "rights": {
        "status": "owned",
        "holder": "Celiums Solutions LLC",
        "transfer": "excluded"
      },
      "visualImportance": "critical",
      "tags": [
        "visual",
        "framework-surface"
      ],
      "variants": [
        {
          "id": "v-favicon-svg",
          "path": "favicon.svg",
          "mediaType": "image/svg+xml",
          "format": "svg",
          "sha256": "da14eb9bb2ab6af68a556001332b32f9f563f7df1f061e976953c7421187914d",
          "bytes": 396,
          "tiers": [
            "universal",
            "lite",
            "balanced",
            "signature"
          ],
          "delivery": "initial",
          "preload": false
        }
      ]
    },
    {
      "id": "asset-fonts-fragment-mono-regular-woff2",
      "label": "Fragment Mono Regular",
      "owner": {
        "entity": "Respective typeface authors",
        "role": "third-party"
      },
      "source": {
        "kind": "licensed",
        "locator": "public/fonts/fragment-mono-regular.woff2",
        "createdFor": "pliegors-site"
      },
      "rights": {
        "status": "licensed",
        "holder": "Respective typeface authors",
        "transfer": "excluded",
        "license": "SIL Open Font License 1.1"
      },
      "visualImportance": "critical",
      "tags": [
        "font",
        "third-party"
      ],
      "variants": [
        {
          "id": "v-fonts-fragment-mono-regular-woff2",
          "path": "fonts/fragment-mono-regular.woff2",
          "mediaType": "font/woff2",
          "format": "woff2",
          "sha256": "44c4e39bff5e76652a24a872cbebabccbcfb20f62c4633b27c1f2745cba86b56",
          "bytes": 25224,
          "tiers": [
            "universal",
            "lite",
            "balanced",
            "signature"
          ],
          "delivery": "initial",
          "preload": false
        }
      ]
    },
    {
      "id": "asset-fonts-instrument-sans-variable-italic-woff2",
      "label": "Instrument Sans Variable Italic",
      "owner": {
        "entity": "Respective typeface authors",
        "role": "third-party"
      },
      "source": {
        "kind": "licensed",
        "locator": "public/fonts/instrument-sans-variable-italic.woff2",
        "createdFor": "pliegors-site"
      },
      "rights": {
        "status": "licensed",
        "holder": "Respective typeface authors",
        "transfer": "excluded",
        "license": "SIL Open Font License 1.1"
      },
      "visualImportance": "critical",
      "tags": [
        "font",
        "third-party"
      ],
      "variants": [
        {
          "id": "v-fonts-instrument-sans-variable-italic-woff2",
          "path": "fonts/instrument-sans-variable-italic.woff2",
          "mediaType": "font/woff2",
          "format": "woff2",
          "sha256": "77210cdde0281b5ecb0d592e063a98656f1bc36993a3b98f506eb91ff4a433a5",
          "bytes": 31828,
          "tiers": [
            "universal",
            "lite",
            "balanced",
            "signature"
          ],
          "delivery": "initial",
          "preload": false
        }
      ]
    },
    {
      "id": "asset-fonts-instrument-sans-variable-woff2",
      "label": "Instrument Sans Variable",
      "owner": {
        "entity": "Respective typeface authors",
        "role": "third-party"
      },
      "source": {
        "kind": "licensed",
        "locator": "public/fonts/instrument-sans-variable.woff2",
        "createdFor": "pliegors-site"
      },
      "rights": {
        "status": "licensed",
        "holder": "Respective typeface authors",
        "transfer": "excluded",
        "license": "SIL Open Font License 1.1"
      },
      "visualImportance": "critical",
      "tags": [
        "font",
        "third-party"
      ],
      "variants": [
        {
          "id": "v-fonts-instrument-sans-variable-woff2",
          "path": "fonts/instrument-sans-variable.woff2",
          "mediaType": "font/woff2",
          "format": "woff2",
          "sha256": "2ee17598a98d8a59e4df8152d015bec9ab8e4d5672cc0ab42bef806b568e3971",
          "bytes": 30092,
          "tiers": [
            "universal",
            "lite",
            "balanced",
            "signature"
          ],
          "delivery": "initial",
          "preload": true
        }
      ]
    },
    {
      "id": "asset-fonts-instrument-serif-italic-woff2",
      "label": "Instrument Serif Italic",
      "owner": {
        "entity": "Respective typeface authors",
        "role": "third-party"
      },
      "source": {
        "kind": "licensed",
        "locator": "public/fonts/instrument-serif-italic.woff2",
        "createdFor": "pliegors-site"
      },
      "rights": {
        "status": "licensed",
        "holder": "Respective typeface authors",
        "transfer": "excluded",
        "license": "SIL Open Font License 1.1"
      },
      "visualImportance": "critical",
      "tags": [
        "font",
        "third-party"
      ],
      "variants": [
        {
          "id": "v-fonts-instrument-serif-italic-woff2",
          "path": "fonts/instrument-serif-italic.woff2",
          "mediaType": "font/woff2",
          "format": "woff2",
          "sha256": "5a51946dfffa82972bc98745359c46761515641fda557c25116459a9f83da4a7",
          "bytes": 22128,
          "tiers": [
            "universal",
            "lite",
            "balanced",
            "signature"
          ],
          "delivery": "initial",
          "preload": false
        }
      ]
    },
    {
      "id": "asset-fonts-instrument-serif-regular-woff2",
      "label": "Instrument Serif Regular",
      "owner": {
        "entity": "Respective typeface authors",
        "role": "third-party"
      },
      "source": {
        "kind": "licensed",
        "locator": "public/fonts/instrument-serif-regular.woff2",
        "createdFor": "pliegors-site"
      },
      "rights": {
        "status": "licensed",
        "holder": "Respective typeface authors",
        "transfer": "excluded",
        "license": "SIL Open Font License 1.1"
      },
      "visualImportance": "critical",
      "tags": [
        "font",
        "third-party"
      ],
      "variants": [
        {
          "id": "v-fonts-instrument-serif-regular-woff2",
          "path": "fonts/instrument-serif-regular.woff2",
          "mediaType": "font/woff2",
          "format": "woff2",
          "sha256": "5eb09b5ac0e28b67c2f041c8ba6d244604ca0c0980d65912ab2d47fed84ddc31",
          "bytes": 21032,
          "tiers": [
            "universal",
            "lite",
            "balanced",
            "signature"
          ],
          "delivery": "initial",
          "preload": false
        }
      ]
    },
    {
      "id": "asset-icon-192-png",
      "label": "Icon 192",
      "owner": {
        "entity": "Celiums Solutions LLC / PliegoRS",
        "role": "house"
      },